{
  "signal_id": "e4f5a6b7-c8d9-4e0f-1a2b-3c4d5e6f7a8b",
  "category": "SkillImprovement",
  "signal_source": "moeb",
  "severity": "Minor",
  "title": "Uncommitted path at spec skill exit: .moeb/runs/20260606T184246Z_spec_Add-a-rubric-criterion--all-skill-files-.json",
  "description": "spec.skill.md exited with .moeb/runs/20260606T184246Z_spec_Add-a-rubric-criterion--all-skill-files-.json uncommitted. This path is not a recognised spec output and was not staged by any git_commit call in this run.",
  "proposed_resolution": "Determine whether run files should be committed in an existing skill phase or handled by a dedicated cleanup step in spec.skill.md.",
  "gating_condition": null,
  "status": "open",
  "occurrence_count": 1,
  "first_seen": "2026-06-06T19:00:00Z",
  "last_seen": "2026-06-06T19:00:00Z",
  "occurrences": [
    { "timestamp": "2026-06-06T19:00:00Z", "run_id": "6e884a36-939f-4295-871d-43a600085722" }
  ]
}
