{
  "signal_id": "f1a2b3c4-d5e6-4f7a-8b9c-0d1e2f3a4b01",
  "category": "SkillImprovement",
  "signal_source": "moeb",
  "severity": "Minor",
  "title": "Uncommitted path at spec skill exit: .moeb/signals/catalogue/e2f3a4b5-c6d7-4e8f-9a0b-1c2d3e4f5a6b.signal.json",
  "description": "spec.skill.md exited with .moeb/signals/catalogue/e2f3a4b5-c6d7-4e8f-9a0b-1c2d3e4f5a6b.signal.json uncommitted. This path is not a recognised spec output and was not staged by any git_commit call in this run.",
  "proposed_resolution": "Determine whether .moeb/signals/catalogue/e2f3a4b5-c6d7-4e8f-9a0b-1c2d3e4f5a6b.signal.json should be committed in an existing skill phase or handled by a dedicated cleanup step in spec.skill.md.",
  "gating_condition": null,
  "status": "open",
  "occurrence_count": 1,
  "first_seen": "2026-06-06T00:00:00Z",
  "last_seen": "2026-06-06T00:00:00Z",
  "occurrences": [
    { "timestamp": "2026-06-06T00:00:00Z", "run_id": "2ebd3ffc-da9e-4cb3-aaa9-808183eccc93" }
  ]
}
