{
  "signal_id": "b1000047-0604-4000-8002-000000000001",
  "category": "ProcessImprovement",
  "signal_source": "moeb",
  "severity": "Minor",
  "title": "MissingMoebTool signals not emitted immediately after ToolSearch and Read calls",
  "description": "fix_signal run used ToolSearch and Read (external tools) to load workflow prompt and tool schemas. MissingMoebTool signals were emitted late (during Phase 5b/rubric processing) rather than immediately after each external call as required by the Tool Origin Policy.",
  "proposed_resolution": "Add a pre-Phase-3 instruction to fix_signal.skill.md: if the workflow prompt was loaded via an external tool, buffer MissingMoebTool signals for those tools before proceeding to Phase 3.",
  "gating_condition": null,
  "status": "open",
  "occurrence_count": 1,
  "first_seen": "2026-06-04T11:22:24Z",
  "last_seen": "2026-06-04T11:22:24Z",
  "occurrences": [
    { "timestamp": "2026-06-04T11:22:24Z", "run_id": "92a0d940-a652-4011-b177-e253ad4744e3" }
  ]
}
