{
  "signal_id": "b8d6f4c2-e3a1-4f9b-c7d5-3e4f5a6b7c8d",
  "category": "NewCapability",
  "signal_source": "moeb",
  "severity": "Major",
  "title": "Missing moeb tool: Bash",
  "description": "Used the Claude Code native Bash tool to run cargo build --release and cargo test from src/moeb/ for Step 7 compilation and test verification. No moeb shell execution tool exists in the moeb registry.",
  "proposed_resolution": "Run moeb spec to introduce a moeb equivalent of the Bash tool covering shell command execution for build and test verification (e.g., a run_command or cargo_build tool).",
  "gating_condition": null,
  "status": "open",
  "occurrence_count": 1,
  "first_seen": "2026-05-31T12:50:00Z",
  "last_seen": "2026-05-31T12:50:00Z",
  "occurrences": [
    { "timestamp": "2026-05-31T12:50:00Z", "run_id": "bb689526-3382-4151-8b6a-f79913a3362d" }
  ]
}
