{
  "signal_id": "b3c4d5e6-f7a8-4b90-c123-d4e5f6a7b8c9",
  "category": "Error",
  "signal_source": "moeb",
  "severity": "Critical",
  "title": "patch_file systematic line insertion failure corrupted README.md",
  "description": "Four patch_file calls on .moeb/README.md each reported 'applied' with no error, but every hunk that added a net new line (e.g. @@ -N,1 +N,2 @@) produced the same line count (234 -> 234) instead of inserting a new line. Each call merged the new content with the following line, progressively corrupting the vcs section structure. Required 4 additional read_file_range calls and a full write_file rewrite (52157 bytes) to restore correct formatting. The normalize_hunk_counts or find_closest_context functions may be silently converting N+1 insertions into N:N replacements on LF-normalized files.",
  "proposed_resolution": "Investigate the diffy crate's behavior when applying zero-context insertion hunks to files with LF-normalized line endings. The normalize_hunk_counts or find_closest_context functions may be misinterpreting insertion-only hunks as replacements. Add a unit test that patches a small file by inserting a new line and verifies the resulting line count increases by 1.",
  "gating_condition": null,
  "status": "resolved",
  "occurrence_count": 2,
  "first_seen": "2026-05-29T16:35:00Z",
  "last_seen": "2026-05-29T21:22:47Z",
  "occurrences": [
    { "timestamp": "2026-05-29T16:35:00Z", "run_id": "67666817-857d-418e-8fce-3428b1dfb313" },
    { "timestamp": "2026-05-29T21:22:47Z", "run_id": "e22533c1-7842-425d-b65a-34cee93b9f89" }
  ]
}
