{
  "signal_id": "4f5e6d7c-8b9a-0e1f-2d3c-4b5a6e7f8d9c",
  "category": "SkillImprovement",
  "signal_source": "moeb",
  "severity": "Minor",
  "title": "Protected-skill guard condition deviates from spec code snippet",
  "description": "Spec Step 2 shows an unconditional guard (`if PROTECTED_SKILLS.contains(&name.as_str()) { return Err() }`), but the implementation uses a conditional check that also verifies local_path.exists(). The conditional approach was required to prevent the kernel itself from failing when loading protected skills internally. The spec raw requirement ('when the kernel discovers a file') supports the conditional approach, but the discrepancy between code snippet and description creates ambiguity for future implementors.",
  "proposed_resolution": "Clarify spec Step 2 to show the conditional guard pattern explicitly, or introduce a separate kernel-internal skill loader that bypasses the project-override guard, making load_skill the project-facing loader only.",
  "gating_condition": null,
  "status": "open",
  "occurrence_count": 1,
  "first_seen": "2026-05-28T16:15:00Z",
  "last_seen": "2026-05-28T16:15:00Z",
  "occurrences": [
    { "timestamp": "2026-05-28T16:15:00Z", "run_id": "6025fff1-96b2-456b-880d-c89bb2bfd3f7" }
  ]
}
