{
  "signal_id": "a5000047-0604-4000-8001-000000000001",
  "category": "NewCapability",
  "signal_source": "moeb",
  "severity": "Major",
  "title": "Missing moeb tool: ToolSearch (deferred schema loading)",
  "description": "Used ToolSearch to load moeb MCP tool schemas during fix_signal execution. No moeb equivalent exists for loading deferred tool schemas at runtime.",
  "proposed_resolution": "Run moeb spec to introduce a moeb equivalent covering deferred schema loading, or pre-load all tool schemas in the fix_signal prompt output.",
  "gating_condition": null,
  "status": "open",
  "occurrence_count": 1,
  "first_seen": "2026-06-04T11:22:24Z",
  "last_seen": "2026-06-04T11:22:24Z",
  "occurrences": [
    { "timestamp": "2026-06-04T11:22:24Z", "run_id": "92a0d940-a652-4011-b177-e253ad4744e3" }
  ]
}
