{
  "signal_id": "a1b2c3d4-e5f6-4a7b-8c9d-e0f1a2b3c4d5",
  "category": "SkillImprovement",
  "signal_source": "moeb",
  "severity": "Minor",
  "title": "Uncommitted path at spec skill exit: .moeb/signals/catalogue/f3a4b5c6-d7e8-4f9a-0b1c-2d3e4f5a6b7c.signal.json",
  "description": "spec.skill.md exited with .moeb/signals/catalogue/f3a4b5c6-d7e8-4f9a-0b1c-2d3e4f5a6b7c.signal.json uncommitted. This path is not a recognised spec output and was not staged by any git_commit call in this run.",
  "proposed_resolution": "Determine whether .moeb/signals/catalogue/f3a4b5c6-d7e8-4f9a-0b1c-2d3e4f5a6b7c.signal.json should be committed in an existing skill phase or handled by a dedicated cleanup step in spec.skill.md.",
  "gating_condition": null,
  "status": "open",
  "occurrence_count": 1,
  "first_seen": "2026-06-06T00:30:00Z",
  "last_seen": "2026-06-06T00:30:00Z",
  "occurrences": [
    { "timestamp": "2026-06-06T00:30:00Z", "run_id": "7bfe65d6-3ead-4483-b66a-f37b87674c21" }
  ]
}
