{
  "signal_id": "5c6e1a74-d3b8-4f2c-a7e9-3b4d8f5a2c63",
  "category": "NewCapability",
  "signal_source": "moeb",
  "severity": "Major",
  "title": "Missing moeb tool: Read for large start_run output",
  "description": "Used Read (Claude Code native) to read the start_run output that exceeded token limits and was saved to a Claude Code internal path. No moeb equivalent exists.",
  "proposed_resolution": "Extend start_run to support chunked or paginated output, or add a moeb tool for reading oversized tool-result files.",
  "gating_condition": null,
  "status": "open",
  "occurrence_count": 1,
  "first_seen": "2026-05-28T17:45:00Z",
  "last_seen": "2026-05-28T17:45:00Z",
  "occurrences": [
    { "timestamp": "2026-05-28T17:45:00Z", "run_id": "fcab4166-c9fb-4583-9248-bbf78f2cef16" }
  ]
}
