{
  "signal_id": "d4e5f6a7-b8c9-4d0e-1f2a-3b4c5d6e7f8a",
  "category": "SkillImprovement",
  "signal_source": "moeb",
  "severity": "Minor",
  "title": "context-budget fires on every skill-file run due to pre-existing oversize",
  "description": "spec.skill.md (535L), run.skill.md (602L), and fix_signal.skill.md (481L) were already over the 300-line context-budget threshold before this run. Any run that writes to these files will fail context-budget regardless of the delta added. The minimum-diff hard rule prevents in-run refactoring.",
  "proposed_resolution": "Dedicate a spec run targeting only skill file size reduction. Alternatively add a context-budget exception mechanism that measures only the lines added by a run rather than the total file size.",
  "gating_condition": null,
  "status": "open",
  "occurrence_count": 1,
  "first_seen": "2026-06-04T20:35:00Z",
  "last_seen": "2026-06-04T20:35:00Z",
  "occurrences": [
    { "timestamp": "2026-06-04T20:35:00Z", "run_id": "4ec859db-b067-4b69-ac84-1780013fa785" }
  ]
}
